1,there isn't need to get in details   but just remember it rocks because:     ease of   and features.
1,i would recogmend this player to anyone i   and you will not be dissapointed.
1,impressive with few flaws.
1,the nomad jukebox zen xtra is a very good mp3 player but the software is it gets hurt.
1,i have no problem using the player itself and i feel it is a very good player.
0,on my main computer the software did not work right.
0,i had to sit on the phone with customer support for 2 hours and they did not help at all.
0,i eventually gave up with customer support and worked on fixing the problem myself.
1,i have the software working fine now and the mp3 player is fantastic.
0,it seems that depending on the system the software might not work or might   because it works on all the other computers i have.
1,so once i worked out the problem with the software this mp3 player is worth the money it cost.
1,awesome.
1,i'm very pleased with my zx so here's a quick review.
0,first there's the unit itself.
1,it is small   bigger than the   but keep in mind that this is because   less expensive but not necessarily inferior technology is used in the zx.
1,the zx boasts superior sound quality than the   however it compromises a bit of the unit's size in doing so.
1,the lcd is larger than the previous   the   and has a bright blue backlight which illuminates the screen more successfully than the nx's green backlight did.
1,the scroll wheel is easy to use and works great for   however many have complained that the wheel is cumbersome and difficult to operate.
1,the sound is excellent as one would suspect from a creative product.
1,the included eax support is useful at   especially when you listen to a variety of   as it will adjust the equalizer for you which can be a big hassle.
0,the environmental     is almost completely useless and has made most of my songs sound worse than without it (i encode my songs at 192056 kbps without variable bit rates.)
1,the signal to noise ratio (the ratio of   useful data to unusable garbage     a radio wave; a larger stn ratio is better) is nice and high at 98   and it should be noted that apple refuses to release the stn ratio of any of the ipods.
1,the software hasn't been a hassle for me at all.
1,i ignored the instruction booklet (as i do with any product) and figured out how to organize separate playlists within minutes.
1,my sister was able to figure it out on her own as   and she is of average computer competence.
1,the less computer-saavy might find apple's software a bit   though (i use it at a friend's house and it does do a lot more for you.)
1,  the price is fantastic:  i spent $ 269 for my 30gb   compared to the $ 299 for a 10gb ipod and the also expensive iriver ihp020.
0,for prospective   i would warn of the following: 1) purchase a better pair of headphones as soon as   as earbuds sound terrible and are terribly uncomfortable (this applies to earbuds in  ) and 2) make sure that your mp3s have id3 tags on   that when when they are loaded into the playlist they will automatically sort themselves.
1,if you want great sound   don't want to spend an arm and a leg per-  don't mind being something of an iconoclast among many ipod   and are willing to sacrifice a few cubic centimeters of your personal space for a large   then i would suggest the zen xtra for you.
1,it's pretty good.
0,read the instuctions - do not plug the zen into your computer until you have installed all the software onto your computer and rebooted it!!
1,(i had no problems since i did this but there seem to be a couple of very bitter reviews further down - maybe they did not do this or maybe there are some very sad ipod owners since they all recomend it instead).
0,and have you seen the price of the ipod extras that you need.
1,eg 60 $ for a plastic box to hold 4 aaa batteries to increase the use time past 60 hrs (reviewers figures)  i uploaded the drivers and new software in 15 minutes - no crashes or problems.
1,transferred the zens new software onto it in about 10 seconds.
1,it is transferes a song in about 2 seconds.
0,usb 1 - very fast  yeah i agree the earbuds are pretty   replace them.
2,but the sound is very good (and loud) and works well on my portable speakers.
1,and for those that are intrested the recharger works anywhere in the world (and is quite small).
2,it looks very   and seems quite small to me and very light.
1,the scroll button seems   i have no problems with it.
1,i am very pleased so far.
1,i had all my files already on my pc in wma format (200 cd's).
1,so far so   no   no conversions.
1,very simple to use.
1,the reason it does not get 5 stars  1) a spare battery would have been great.
1,2) no games - it has a cool screen - why not use it.
1,3) it does not work automatically like a hard drive when you connect it to your   like some players  all in all suprisingly easy to use.
1,a great player for the price.
1,summary:  lots of   but exceptional sound   hd   and price make it a good buy.
1,pros:  excellent sound - i found the music reproduced faithfully through the jukebox.
1,there was no distortion and it sounded   especially with eax environmental audio enabled.
1,transfer through windows explorer - windows recognizes the jukebox as an additional hard   so it allows you to simply drag and drop files from windows explorer to a folder for the nomad.
1,i found this to be a much easier method of transferring my music to the nomad than using their software.
0,  it doesn't register instantly as a hard drive like other players.
0,you have to install the software to the computer you're transferring   instead of just connecting it with a usb connection.
0,this would have been much easier.
1,the nomad can hold any type of   not just mp3, so you can use it as a portable hard disk.
1,i found it very useful for transferring large files to another computer.
1,this almost made it worth the price alone.
1,i was able to easily copy 2gb worth of video files from my   and then transfer them to a friend's.
1,huge storage space - even at 320  you can store a ton of songs on this thing.
1,30gb is more than enough for most people.
1,having usb 1 makes for very fast transfers.
1,it only took me about 10 seconds to transfer a 200mb file.
1,it took maybe 15 minutes to transfer 1000 songs.
0,cons:  navigation system - the zen xtra uses id3 tags that are embedded in the mp3 files to organize your songs.
1,this is great as long as all of your music have id3   and if you've downloaded your songs off the   many probably don't.
0,it would have been much easier to use a windows explorer style navigation system.
0,you can't simply open up a folder from the player and play all the songs in it.
1,whe you transfer your songs to the   it dumps all of them into a single   and then sorts them by the id3 tags.
0,fm receiver - it has none.
0,i would be nice to have a simple fm receiver so i could pick up local stations.
1,that way i could get rid of a walkman alltogether.
0,cheap construction - they should have made the player out of hard plastic and put some rubber on the corners.
0,the player feels very   as if i'm holding an actual hard drive.
0,i'm not sure if it would survive a fall from 3 feet.
0,as a portable   it should feel a bit more durable.
1,the top of the player is a thin metal piece that covers up the battery and is removable.
0,i could crush this thing in half with two fingers if i wanted to.
0,this is not a player you can take jogging.
0,the songs don't play one after another like on a cd.
0,you have to add them to the playing list.
0,i can't simply bring up my entire list of   click   and then hit next.
0,you have to add all the songs to a play list.
0,there is probably an easier way to do   i just haven't found it yet.
0,software - the software is crap.
1,i use it for ripping   which it does a pretty good job of.
0,  it is difficult to figure out and awkward.
0,like most   i don't want to read the   i just want to use it.
0,even after reading some of the   it's still hard to figure out.
1,i would recommend replacing the existing software with the " notmad   " which is simpler to use and can be found on the internet.
0,no line out jack - as i   there is none.
1,the headphone jack acts as a pseudo line out jack.
0,so you can plug your nomad directly into your stereo or use a car   but you don't get the quality from a true line out jack.
0,it sounds   but i would estimate you get maybe 80% of the quality that you would from a true line out jack.
0,controls are a bit awkward.
0,the controls definately took some getting used to.
0,it wasn't as easy to fast forward or pause a song than it was with a regular walkman.
0,when i first had it i kept finding myself having to look at the nomad to figure out where the skip button was.
0,a sliding old fashioned volume knob would also have been easier than the digital version that was included.
0,i want to have instant access to the   not have to hold down a button and have to wait a half second for the player to register it.
0,crappy headphones.
0,the included earbuds were uncomfortable.
0,i would replace them with some better sounding and more comfortable phones.
0,difficult navigation - i won't necessarily say "   " but i don't enjoy the scrollwheel to navigate.
0,it is a bit   and i can't get to the songs i want as quickly.
0,i think this is it's biggest flaw.
0,i would much more have preferred a keypad-type navigator like found on dvd remotes.
0,      and right would have given me better control.
0,if you hold down the scroll wheel too long (which is common if you have a lot of songs to sort through), it will get " stuck " rapidly going through the songs and won't stop until several seconds after you let your finger off of it.
1,case - the nomad comes with a leather holding case.
0,it would have been much nicer if it had a window so you could see the   and if the button didn't cover up the ac jack.
1,that way i could keep it in the case all the time.
0,as it stands   the case is pretty useless unless you're packing the player up for   or if you load up all your songs beforehand.
0,you can cut up the case a bit with an xacto knife and make it useable though.
1,  i feel that it's a decent   and am happy that i own it.
1,i am willing to overlook it's problems to get superior sound quality and low   although i feel the player has a lot of room for improvement.
0,good for the   but software is awful.
1,after looking over multiple large mp3   i decided to get this one.
1,for the price and size and   you can't beat the price.
0,a 10 gb ipod is just as much and i have heard from multiple sources that the ipod is very loud and you can heard the hard drive everytime it   accesses files or does antyhing.
1,i think the reson for the creative being larger is for sound dampening and   whihc is a   but then again it is only speculation.
2,the buttons and interface are very easy to use.
1,simple click   back buttons volume and display are very easy to   access and use.
0,but the major problem i had was with the software.
0,you are not able to simply import   but rather you have to go through multiple steps to find them.
0,the instructions that come with it don't explain how to make things simple.
0,the quick sync isn't any good becuase it either needs to be configured properly or just isn't very useful.
0,i tried to make sense of the file transfer program and just got more confused.
0,i tried to take a cd and simply rip it onto a hard drive and then transfer into the player.
0,well that was not a simple task.
0,i ended up suing windows player to make mp3's (actually wma files) and then using the probram to transfer.
0,i think the lack of the mp3 player being able to run without special software is also a   becuase it makes it more cumbersome for people less computer illiterate.
1,buy this for the storage and   avoid it if you know nothing about computers.
1,buy this instead of an ipod.
1,with this mp3 player you get much more memory for much less than an ipod.
0,an ipod with the same amount of memory is $ 150 cheaper.
1,the reason for this the ipod has " a better user interface ".
1,i have found that the interface on the nomad is very easy to use if you have a basic knowledge of a computer.
1,also the ipod has games on it.
1,games are ok for a cell   but mp3's are for music.
1,this thing roxxorz.
0,i purchased this player last week.
1,i did a little research on the web and this is the player i decided on.
1,i refuse to buy anything made by apple and the nomad is about $ 200 cheaper anyway.
1,i have had no problem what-so-ever with this product.
1,the software installed flawlessly and without any problems on my windows 2k machine.
0,the headphones aren't the   but you can really expect much out of the small headphones you insert in the ear cavity.
1,the battery life seems   takes very lttle time to   it uploads mp3s quickly and there is no delay between songs.
1,took me a few tries to get use to the   but it's a very user friendly player imo.
1,i haven't messed with the firmware at   the player worked perfect for me right out of the box.
1,all-in-  this is another excellent creative product.
1,if you have the money and need 40   this is the player for you.
1,it's   light and nice looking and the display is decent as well.
1,i would recommend this product to anyone.
1,it doesn't get any better than this.
1,before asking for the zen xtra specifically for christmas i researched many different mp3 players but finally decided on this   and now that i have it i couldn't be happier and i'm convinced it's the best one out there.
1,many people have written about the software being its one   personally i haven't had a single problem with the   i'm running windows me.
1,the cd ripping to mp3 is so   and you can even rip the cd directly to the mp3   so it won't take up space on your pc hard drive.
1,the software runs   it's nice to look   it's very   easy to follow and makes things very simple.
1,the controls on the player are very   no need for a manual.
1,the player is fast and sounds   it also has many options like slowing or speeding up the   or making it sound like you're hearing the music in a huge auditorium.
1,the battery lasts very long when playing   but writing files to the player drains the battery   so you need to have it plugged into an outlet when sending files.
1,playlists can be made on the   without aid of a   and you can use play modes like shuffle and repeat for your ' now playing ' selections or playlists.
1,the software couldn't be better and the mp3 player works like a   i couldn't give this anything but a 5, i wish there was a 6.
0,difficult to manage large library.
0,i purchased and returned this   but not because of any glaring flaws in the design.
0,i made the mistake of thinking i could easily manage my mp3 library with this device.
1,i initially loaded about 3700 tracks with the intent of ripping the majority of my remaining cds to mp3.
0,i quickly discovered that the nomad wasn't going to work for me.
0,the reasons below will be true for any product in this category.
0,here's why:  1. i don't need the nomad at the office.
1,i have my mp3's stored on my workstation.
1,2. i don't need the nomad at home for the same reason (although using it to sync between the two pc's might be a reason enough to get it.)
0,3. it's a hazard in the car.
0,the navigation is nice   but scrolling and searching through thousands of   hundreds of albums or   or even dozens of genres is not conducive to save driving.
0,(throw a cell phone and you're asking for trouble.)
1,) 3a.
0,creating playlists using the included software to minimize issue 3 wasn't as easy as i would have liked.
0,the bottom line:  if i have to get into making playlists to avoid rear-end   i'll just buy a regular portable cd/mp3 player and burn myself collections of about 120 tracks per disk.
1,sure it's " old school " to carry a cd wallet   but it will be easier to manage and i'll save around 250 bucks.
0,one major complaint:  my only significant complaint is sound quality.
0,the eax sound enhancement feature didn't do enough for me and the custom eq was a limited 5 band eq.
0,this did not give me enough control.
0,i wanted to use the nomad with a cassette style car adapter.
0,i was unable achieve a sound quality on par with my simple portable cd player with " bass boost.
1,"  the sound quality of my cd player is superior in this setting to the nomad.
1,it is an extremely cool gizmo.
1,great product.
1,well in the beginning i was asking around for mp3 players.
0,so then i came across the ipod (10 gb).
1,so i was all excited about the ipod but then the day before i went to best buy to check out the other mp3 players and i came across this one.
1,well i decided to get this one.
1,well i have to say that this product is very good i mean it might be a little big but it still fits in your pocket.
1,well surely this is a product that i recommend someone in getting rather than any other mp3 player (at that size and the price).
0,well just one con - its not really plug and play at first i mean its very confusing to start the program but one you do   it will be a breeze.
1,enjoy.
1,in a word... amazing i got this for christmas.
1,i was going to get a 10gb   but after looking at the 10 day warranty for ipod and www.ipodsdirtysecret.com (battery lasts 18 months;  it costs like 200 dollars to replace - now you mail it off to get the battery replaced for like 99...  what a big improvement... lol) and the fact that lots of people have had problems with ipods on windows   i realized this is a much better buy.
1,not only is it more   but its a better player for   which is what i have.
0,  on with the review.
1,so far i've only had it since   so i cant tell you much about the battery life.
1,it hasnt gone below the second notch (i charge mine whenever i'm at home and not using it), so the battery life seems fine (so far).
0,software: for the people who complain about     stop complaining.
1,once you hook the thing up to the computer (via the usb cable), the machine instantly recognizes the fact that it's there &amp; installs the drivers.
1,from   you transfer files from your computer to the mp3 player (with the help of the media sniffer... read the manual).
0,my only complaint would be that you need id3 tags &amp; that takes a while to do if your mp3 files don't have them.
1,if you're copying cds with windows   its really simple to give your songs id3   so thats what i do.
1,oh... and file transfers are fast &amp; easy.
1,the player: it's silver.
1,a little weighty (9 ounces... no biggie), but otherwise fine.
0,people complain about the scroll   but its not a big deal at all (though it is just a little annoying at times).
1,it's easy.
1,the buttons are easy to   and its easy to navigate.
1,the big backlight makes things easy to   and the writing is big enough for people to see.
1,my favorite thing about the nomad is the eax feature.
1,you can customize   etc.
1,like   but also you can customize the sound of the player (like how it would sound in a concert   jazz   etc).
1,its really cool.
3,sound quality is amazing.
1,i was expecting   but its really good (especially if your files have good sound quality).
1,you can also slow a song down &amp; speed it   which is cool too.
0,but the earbuds suck!
1,buy new ones asap.
0,every time you move your face or something they pop out.
0,for a 250 dollar   they could have thrown in nice headphones.
0,a remote would have been cool too... but lets not push it.
0,oh... one more thing.
0,i   the case doesn't fit.
0,my case doesnt close... maybe mine was just   but the case isnt that great.
0,so far the player froze on me once (i started pushing buttons before it loaded) but since is hard drive based - you have to expect that.
1,so all you do is stick a pin or something small in the reset button &amp; you're golden.
1,  you can store data on   which is a plus.
1,for all you people who want to buy an ipod just to say you have an   don't   this is a much better buy.
1,hope i helped!
0,simply doesnt shine.
1,i'd like to start off saying that before this product i was using an archos jukebox recorder...  what made this product so great to me was the open source os called rockbox...  based on hardware one could assume the archos players were horrible (which by hardware standards... they were)...  but because a few fine men and women took the time to create the upstanding rockbox   the archos became a top notch player for me with intuitive features out the wazoo...  now we come to the zen xtra...  first i'll start off by saying that this players hardware is pretty good...  the sound is indeed excellent and the form factore is not bad (but still rather larger than i had expected)...  what really made this a mediocre mp3 player for me was the software.
0,not just the transfer software (which was a hellishly horrible experience) but also the player's software.
0,first of   many actions that the player utilizes don't make sense..  bookmarks for   are an excellent feature... but not on this player...  rather than creating a directory for bookmarks to be found in one   the user must actually find the track where the bookmark was made..  this makes no sense and sort of defeats the purpose of audio bookmarks...  the dynamic playlists (" now playing ", i belive creative calls it) feels very awkward at times and some menus simply take to long to get to and operate...    anyway i could go on and on on why this player didn't meet my expectations...  i'll just say this...  for the average music listener not expecting much... this may be a satisfactory mp3 player...  but for someone who cares about thier music collection and wants fluid and responsive playback... i can't recommend this product.
1,excellent product with a few minor problems.
1,i became interested in getting a mp3 player when i got a new work computer; while my office bars the addition of any non-work   it doesn't care if you load cds onto the hard drive.
1,over   i loaded hundreds of cds onto the   and the idea of carrying around all of my music with me became attractive.
1,many people recommended the   and i borrowed one from a friend.
0,while the ease of use was very   i was put off by the price -- about $ 130 more than what i paid amazon for this player.
0,  there is the need to send the ipod to replace the batteries when they die (which they will).
1,i have had the nomad jukebox for about three weeks   and i am very happy with it.
1,it's only slightly heavier than the   and has a longer battery life.
1,the storage capacity is great for me --  i have a large but not huge cd collection and have loaded everything i want to listen to on it and still have 13 gigabytes free.
1,the controls are somewhat harder to use than the   but i have gotten use to   and even at the beginning did not think would justify the huge difference in price.
0,loading cds was somewhat time-  but i think it would have been with the ipod as well.
0,i had never loaded my cds on to my home   using my work computer instead.
0,my office would not let me put the software on to my work computer.
0,this meant that i had to take all my cds and do in a fairly short period of time what i had done over a year at work.
1,if the music had been on my home   the transfer would have been accomplished very quickly.
1,i have an older   running windows 98   and so those of you with something more recent would find the process even quicker.
0,my only reservations about this product concern the tagging process and the way it interacts with the software.
1,when you load a   you go to an internet cite for the insertion of the names for the cd and the tracks.
0,while the listing process is accurate for track names (unlike windows ' reliance on the   which frequently gets track listings out of order), the results can be odd.
1,the cd will be classified into a number of   and in multidisk   you can get separate classifications for different disks by the same artist and the same performance.
0,for   jimi hendrix's 2 cd live at the fillmore east had one cd classifed as classic rock and the other psychidelic rock.
0,perhaps the weirdest was one of bruce springsteen's cds from the tracks set being classified as goth rock.
1,you can change any of   but need to be paying attention when the information is downloaded before you copy it.
0,a somewhat more troublesome problem is that the internet site will sometimes give different discs of the same set slightly different names.
0,this will cause the discs not to show up together when you are looking for them on the nomad.
0,  you can change   but it's harder to spot a minor variation in the title when you don't have the title of the other disk in front of you.
0,other tagging problems result (i think) from the nomad's operating system.
0,if you have two tracks with exactly the same name on one   it will not copy both -- it gives you the option of skipping the second or overwriting the first with the second.
0,this is rarely a problem with any kind of popular   but can be troublesome with classical music where tracks are identified by tempi.
0,i also had it happen when recording a jazz set where there were a number of outtakes of the same song without numbering them separately.
0,the way to fix this is to rename the track by adding a number yourself to the end of the track listing.
0,  i can't understand why the software does not ignore " the " when it lists the cds in alphabetical order.
0,  making playlists from the computer can be complicated because the tracks are listed   and are organized by   which are not listed but are organized in alphabetical order.
0,in other   to locate a track using the software on the computer and add it to a   you must know the name of the cd it appears on and then find the track by locating the location of the unlisted cd by looking for tracks that appear on it.
