0,troubleshooting ad0500 and ad0600 no picture scrolling b/w.
0,repost from january 13, 2004 with a better fit title.
0,does your apex dvd player only play dvd audio without video?
0,or does it play audio and video but scrolling in black and white?
0,before you try to return the player or waste hours calling apex tech   or run the player over with your   try these simple troubleshooting ideas first.
0,no picture:  hopefully you still have the remote control.
0,if you tossed it out the   you need to fetch it.
1,using the remote   press the i/p button located on the bottom right corner of the remote.
1,the i/p button switches the tv display between interlace and progressive.
0,if this doesnt bring back the   try pressing this button without playing a dvd.
0,if you dont get video   now you can run the player over with your car!
0,picture scrolling in b/w:  you need the remote control for this so you better get it from your dog before he burries it in the backyard.
1,press the p/n button located on the bottom right corner of the remote.
1,the p/n button switches your dvd players video output signal between pal and ntsc.
1,by pressing p/  you should be able to get a good picture on the screen.
1,for other problems go to http://www.apexdigitalinc.com/support.asp  i hope i have helped you continue to enjoy the apex dvd player with these troubleshooting tips.
0,i have done some research and experimenting with the remote when my apex ad0500 seemed to have lost its video signal.
1,im a more happier person after discovering the i/p button!
0,the button was probably accidentally pushed to cause the black screen in the first place.
1,  if you're looking for my opinion of the apex dvd   i love it!
1,it practically plays almost everything you give it.
1,i've had the player for about 2 years now and it still performs nicely with the exception of an occasional wwhhhrrr sound from the motor.
1,for the price it is a well spent investment!
1,i would recommend buying one.
1,incredibe price / performance.
1,i've owned 6 or 7 dvd players since 1998.  this is by far the nicest   in so many ways.
1,it's very sleek looking with a very good front panel button   and it has a great feature set.
1,its fast-forward and rewind work much more smoothly and consistently than those of other models i've had.
1,it plays alternate video formats (    cvds) very well.
1,it plays alternate video formats (    cvds) very well.
1,and amazon.com has it for such a great price -- how can you go wrong?
1,i've bought one for the den and will buy a 2nd one for the bedroom.
1,strengths are well listed by other reviewers.
1,what got me to buy was the reviewer that said it would play dvd-rs fill of files (e., mp3s).
0,1,it sure does!
1,1,that's a rare and valuable feature.
1,i have a dvd burner on my computer and a zillion mp3  and it's a lot nicer to access them 1 gb at a time (dvd-r) than 1 gb at a time (cd-r)!
1,another nice thing is that the unit has both optical and coax digital audio   though the latter was not mentioned in the literature i'd scanned before buying.
1,saved me from having to buy an expensive optical   as i already had a coax cable.
1,at double-speed (2x forward speed), it still plays mp3s with sound -- they are pitch-corrected and   but twice as fast!
0,i wish it would do the same for   but that's one rare / cool feature you will have to forgo.
0,weaknesses are minor: the feel and layout of the remote control are only so-so; it doesn't show the complete filenames of mp3s with really long names; you must cycle through every zoom setting (2  3  4  1/2  etc.
1,) before getting back to normal size [ sorry if i'm just ignorant of a way to get back to 1x quickly ].
1,if you're a bargain hunter and you want a great feature set for a rock-bottom   i highly recommend this model.
1,update: the finish is more " mirror " than silver -- and i like it!
0,doesnt play new disney movies.
0,many of our disney movies don't play on this dvd player.
0,i spoke to a rep. at apex and was told that a new format is being used and we wont be able to view any disney movies made in the last couple months.
0,poor quality - problem with dual-layer dvd's.
0,player has a problem with dual-layer dvd's such as alias season 1 and season 2.  for the   get a better quality player.
1,player works and looks great - if you can get the dvd's to play.
0,i know the saying is " you get what you pay for " but at this stage of game dvd players must have better quality than this - there is no excuse.
0,will never purchase apex again.
0,customer service and technical support are overloaded and nonresponsive - tells you about the quality of their products and their willingness to stand behind them.
0,pass this player   and never believe the reviews on a product right before christmas!
0,has destroyed several of my dvds and cds.
1,for the first few   this player was everything i expected it to   an affordable multi-format dvd player with a stylish slim case as advertised.
0,then my dvds would stop playing in the   or not even be read at all.
0,new cds almost always began skipping after a few plays.
0,i thought it was just the   but then i started checking the discs to find that the apex 2600 is actually ruining my media.
0,there are funny little ridges on the dvd that look like the slice of a tree trunk!
0,this player is not worth any price and i recommend that you don't purchase it.
0,i intend to contact the   but from what i've read.
0,i just got screwed out of fifty bucks.
0,apex doesn't answer the phone.
0,* sigh.
0,their customer service sucks.
0,no way to contact their customer service.
0,very bad quality.
1,great value.
1,i bought this apex 2600 dvd player for myself at christmas because it got good reviews as a good value for the money on a variety of different sites.
1,i took it to my father's house to play a tom jones concert dvd and he loved the player so much i gave it to him.
1,now i need to buy myself another one!
1,have used it frequently and have had no problems.
1,i always research electronics online before i buy because even within the same   some models are better than others.
1,i liked this one enough to buy another.
1,my dad also has an apex tv and it was another great value for the money.
1,great quality picture and features.
0,2 out of three ain't good.
0,thought i'd weigh in here with my stats.
1,i've bought 3 apex dvd players now.
0,they play just about   but # 2 and # 3 died very shortly after getting them.
0,i am back to using # 1.  nice   but i consider their quality pretty low now.
0,buy a better known brand name.
0,this item broke just two weeks after i gave it to my kids for christmas.
0,the door would not close.
0,i tried to contact apex to return it (i missed the amazon return period) and it took 3 months to get through to their customer service dept.
0,i am still trying to resolve it four months later.
0,piece of crap... it looks great - and is loaded with features.
0,unfortunately it turns out to be the " disposable " type.
0,have had problems since the first day  - not playing some dvds and then finally after less than 60   it just would not recognize anything i pop in it.
0,save money on the long run - buy something decent once instead of buying cheap every month.
1,i've had no problems.
1,the apex 2600 has been a steady performer for me.
1,i bought mine in december of 2003, and have had no real problems with it.
0,it does tend to run quite hot and should be given lots of room for air circulation.
0,it did also seem to have a strong " new electronics " smell for some time.
0,the only thing i did experience was a problem of the player freezing while   which i was able to clear by opening it up and blowing it out with " canned air.
1,"  this problem vanished after the first   so i assume it was a temporary dust issue.
1,the fact that this model would play jpeg slideshows was a big plus for me as a visual   and i discovered by accident (it is not mentioned anywhere in the literature) that it will play mpeg1 files on a regular cd-r data disk without vcd formatting.
0,the remote is   but i am not a fan of remotes with tiny buttons.
1,i especially like the more commonly used   such as     and   to be larger and conveniently placed.
0,while it is true that it will stand on   it is also easy to knock over that way.
0,i also didn't like the way it displayed information way down into the screen when you are in zoom mode.
0,the zoom goes up and down in   which is   but there is always a display of the zoom size about one-quarter of the way down from the top of the screen that interferes with viewing at most settings.
0,having spent considerable time with professional video   i find onscreen displays annoying.
0,i have not used the progressive scan feature.
1,this model has come down in price since i purchased mine.
2,while it seems like some people have had trouble with   mine has run   and i would recommend it if you are considering a dvd player purchase.
0,any possible problems should be weighed against the bang-for-the-buck   along with the fact that companies like apex seldom have good after-sale support.
1,while i would like to give it 1 stars instead of 4, i gave it a 4 because it has run well for me during the time i have owned it.
0,do not buy this piece of junk.
0,i purchased this unit 3 months back and i think the unit knew when my warrenty expires.
0,it is more than 90 days and it does not show the picture no matter what i do.
0,i can only hear the sound.
0,i changed video   tried connecting to tv on input1 and input2 but no help.
0,i think you get what you pay for stands true.
0,nice paperweight.
0,i have had this player for 3 months and have been able to see a total of 6 dvd'  after the frustration and aggrivation of getting the player to do it's job.
0,i have tried many times to get a hold of apex who doesn't seem to answer their emails and telephone number is constantly busy as (i believe) the one lonely customer service rep is probably extremely overworked.
0,as i emailed to the the customer service   the only thing this player has done consistantly is use enought electricity to keep the red led burning.
0,do yourself a favor and save your money to get something of better   or at least works.
0,worst piece of electronics i ever bought.
0,if i could give this a negative   i would.
0,i am surprised amazon still carries this after all of the continued problems.
0,won't play a lot of discs.
0,i can only confirm what other customers have said - crap!
0,some movies it played   it won't play today.
0,tech support from apex is literally - nonexistent.
0,  do your customers a big   don't carry this   and give them refunds!
0,there should have been a recall on this product.
0,fair warning - do not buy.
0,i repeat - don't wast your money.
0,don't buy!
0,i bought 2 of this model for christmas presents and neither one of them work!
0,it is embarassing getting phone calls from family members telling you that the dvd player you gave them less that 3 months ago is no longer working.
0,one stopped working in february and the other in march.
0,amazon has been working with me to refund my   but they reminded me that i have past the 30 day return policy and this was a courtesy return.
0,i have had great experience with   but i will probably not buy electronics any more from them to avoid any future return problems.
0,we had problems.
0,the dvd player does not work properly.
0,the player usually plays dvd'  but has occasional problems such as: 1) not recognizing a dvd 2) stopping a particular point in a movie every time we played it 3) not being able to access certain special features on a rental dvd.
0,this has happened with several different dvd's and occasionally if we keep trying   it will work when it did not work one time before.
0,after we discovered the   we tried to contact apex (fkor 3 months), but we never got in touch with them.the customer support telephone number is always   and they do not answer their web customer support.
1,ok if you have a 2nd dvd player.
0,i have had this dvd player for about 3 months now.
1,nothing has broken on   and it plays all the dvds i have.
0,unfortunately it can't play all of the dvd.
0,i have several tv shows on dvd so they are divided by episode.
0,on 2 dvds so far it refuses to play certain episodes with no problems on the others on the dvd.
0,luckily i also have a ps2 which can play those episodes the player can't.
0,unfortunately i bought a player because the ps2 couldn't play all my   and now the player can't play everything.
0,another person who had problem with picture after one use.
1,i purchased this as a christmas gift for my husband.
1,we tried it out christmas night and it worked great.
1,even viewed cds full of jpgs.
0,we didn't get to use it again for over a month (  i know).
0,but when we went to use it   there was sound but no picture.
0,we saw reviews that said the same   and also saw here that their customer service stinks.
0,though we were past the deadline for returns (by a few days), i contacted amazon right away and pleaded for help.
1,they authorized my late   and hopefully they are giving apex heck.
0,i hate apex but love   and i tell everyone.
0,do not buy this player.
0,who knows how many uses you'll get out of it before it craps   but it probably will.
0,frustrating just hope you never lose / break the remote for this player!
0,we've purchased 3 universal remotes so far-all claiming to work " apex " dvd players and none worked.
0,called customer service and basically was told to either keep buying univ.
0,remotes to try or buy the replacement remote for $ 23 (which is almost half of what i paid for the whole player).
1,if anybody knows of a remote to work this-i'd love to hear from you!
0,(on here of course)   a couple dvd's wouldn't play and they were new ones!
0,poor customer service.
0,i had to return the remote on this product because it appeared to be defective.
0,it took over 2 months and repeated follow-up to get it replaced.
0,the customer service dept did not list a toll free number and it was a real hassle to get through on their regular line.
0,i would not be inclined to purchase an apex product again.
0,a piece of junk.
0,door broke after a month.
0,unit took forever since the begiining to recognize and play discs.
0,3 months of use and it no longer recognizes anything.
0,forget about it.
0,it's money down the drain.
0,get cheaper panasonics or toshibas or even sonys.
0,to quote bart: " craptacular ".
0,  it was nice while it lasted.
0,after @ 3   it stoppped playing higher number scenes on dvds.
0,as an   i am embarrassed for the engineering profession when such crap is released for sale.
0,poor quality.
0,only used for 3 month before it's down!
0,i had hoped this was bought from walmart so that i could return it!
0,it sends discoutinous signals to   so the tv has the pictures for one moment and has only the white noise for the other moment.
0,the other thing i don't like about this 2600 is that it makes the color look over saturated.
0,maybe it's good for tvs with not so good color   but not good for my tv that already has very vibrant pictures.
0,returned after failing to play dvds.
1,i purchased the ad2600 after feeling comfortable with the reviews i read here on amazon.
0,as soon as i lifted the unit out of the   i questioned my judgement.
0,the entire unit was poorly crafted.
0,there were sharp screw tips on the underside of the unit coming from inside that were obviously used to anchor the internal control board.
0,after hooking the thing   i found that it would only played less than 50% of the dvds i put in it.
1,most of the dvds i was trying were fairly new and were in great condition.
0,the dvd player just would't recognize them.
0,it would     spin some more and then show on the display that there was no disc.
0,i ended up sending the unit back to amazon.
0,apex ad2600.
1,this dvd player plays raw mpeg2 and mpeg1       cdr / cdrw / dvdr /   and of course plays dvd movies from uk.
1,i love the   progressive scan feature.
1,now it would have gotten 5 stars had this baby come with features to upgrade the firmware and was able to play divx or avi videos.
1,but for $ 41 go get one!
0,features and looks this dvd player is overpriced had it come with sony or one of the other top brand names.
0,customer service nonexistant.
0,i have not even used my new dvd player and already i am disapointed!
0,i have been trying for over a week to contact apex.
0,they will not respond to my emails (promised turnaround time is 24 hours) and the phone line is constantly busy.
0,all i am looking for is a rebate form!
1,what a buy... i accually didn't buy the apex ad0600 from amazon   the reviews i found here helped me purchase it.
1,i have owned an apex ad0201 for close to 3 years now and i love that deck.
1,because of it's hidden features (no   non-regional) i keep this baby around to watch non-american region dvd's.
0,  the ad0600 doesn't have this feature (for now).
1,the cool thing about the ad0600 it plays alot of different file like mp3, wma   jpeg and kodak picture   dvd'  dvd - / + r's.
1,it's not a listed feature   the one thing that sold the unit is that it plays mpeg video.
1,i find this to be a great feature.
1,i've tried playing all of these discs and they all play great.
1,for the money apex machines have good features.
0,you can't find the mpeg playback on high priced units.
1,it's low   space saving design looks nice.
1,i find the apex ad0600 to be a great buy.
0,avoid apex dvd players - even if they're free!
1,i received this dvd player free with the purchase of a palm tungsten e from officemax.
0,now i know why - they are pieces of junk.
0,less than a month later the screen freezes and eventually shows " no disc.
0,"  this is the second apex dvd player i've had - and the last.
1,best player for the buck.
1,i was surprised to find that not only could this dvd player play mpeg2 format which allowed me to stack 2 movies on a   but it also was able to play vob files which i created with smart ripper.
1,the aff feature did a great job converting the letterbox to fill 3/4 of the screen and the image still looked normal.
1,loved the slim design.
0,black and white only after 1 month of use.
0,this unit was working fine for the 1st month and a half and then the color signal disappeared.
0,apex has still not responded to my email describing the problem after almost a week and their customer service line is always busy.
1,most bang for the buck.
3,i recieved my 2600 4 days ago and feel that this may be the best $ 50 i have ever spent.
1,it plays all my back-  + or -, and everything else i have put in it without a hick up.
1,audio is excellent.
1,well worth the money.
1,for the   an excellent buy.
1,after having bought and been disappointed in another brand of dvd   i purchased the apex ad2600 from amazon and first of all i should say it was delivered much more quickly than i had expected.
1,(good   amazon).
1,i am very pleased with the apex ad2600.it plays just about anything you put in the drawer.
1,so far i've played regular dvd'  backup dvd-r'  mp3 cd'  and regular cd's.
1,i have not yet tried the photo show   but i'm thinking that will probably work well   based on the success with the above mentioned disks.
1,i do want to mention too that it is certainly worthwhile to read the instruction manual that comes with the unit.
0,the comments i've read about having problems with this dvd player all seem to stem from pushing the incorrect buttons on the dvd remote.for   pushing the button to play pal (european type)   when an ntsc (usa type) movie disk is in the disk tray.
1,  if you read the instructions   you shouldn't have any problems with this dvd unit.
1,i can't speak to its long-term   as i've only had the apex ad2600 for a little over a week at this point.
1,  it seems to work so well   that i don't anticipate any problems with it.
1,bottom line for me is that for the price i don't think you can go wrong at all by purchasing this dvd player.
1,excellent second   or first dvd for hdtv ready tv.
1,wow!
1,simple to use and hook up.
1,comes with standard rca jacks for   along with s-video output (s-video cable not   must be purchased seperately) and also component video outputs.
1,the progressive scan option can be turned off easily by a button on the remote control which is one of the simplest and easiest remote controls i have ever seen or used.
1,i also own an " apex ad 1201 " dvd player and have had no problems with it since i purchased it almost 1 1/2 years ago.
1,one big difference between the 1201 and the 2600 models is that the 2600 model is virtually silent.
1,and doesn't need to be placed in a cabinet like the 1201 does.
1,friends of mine who own apex tv sets are also all very pleased.
1,i would not hesitate to purchase this if you are uncertain of the brand name.
1,consider it for a future gift too!
0,save your money.
0,this dvd play is basicly junk.
0,it won't play all of my movies.
0,keeps coming up with no disk errors.
0,i tried called apex cust   no help.
0,don't waste your money.
0,mine was 2 weeks old and i chucked it in the   where it belongs.
0,this is the 4 apex player that i have bought.
0,you might think you are saving money by buying an apex but in the long run you will spend more.
0,each of the 4 lasted less than six months.
1,you can get a pretty good progressive scan sony or toshiba now for 68 bucks just about anywhere.
1,spend the money its well worth it.
1,what a dvd player!
1,this is the best dvd player i've purchased.
1,i've owned a panasonic and sony dvd and this one outperforms in function and image quality and most of   access speed.
0,for those of you who has problems with this   i'd suggest checking the owners manual to get the right setting so that you are not displaying the wrong mode and have no   etc.
1,this player has worked flawlessly for me and at this   you can't go wrong.
1,80% of the features on here you will not get by spending $ 100 on a sony or panasonic.
0,having said   this is what you do.
1, check out !
1, enjoy !
0,apex ad2600 known capadabilty problem.
0,i have sent my ad2600 back to apex because it won't play certain disney and other dvd movies (no disc message).
0,they sent me a new ad2600 with the same problem.
0,i call apex customer service and they told me that there is a known problem with the model playing disney and other movies and that it is not there problem so i'm stuck with a new dvd player that won't play my kids disney movies.
1,value for money!
0,i bought this dvd player mainly because my old sharp dvd player could not play most of the dvds from the store that i rent from and i had to watch them using my pc's dvd-rom player.
1,  this apex dvd player turned out great!
1,it plays basically every media i've tested so   even an old vcd that i ripped years ago and the rental dvd that couldn't be played on my old $ 200 sharp player!
1,i have to say i'm also pretty impressed by the user interface for playing   mp3 and mpeg files stored on cd-rs / dvds.
1,it's almost like having a media player / file manager built into the dvd player.
1,i did not want to have high expectations for this apex player because of the price but it is definitely working out much better than what i would expect from an expensive high-end player.
1,what more can you ask for from a $ 40 dvd player?
1,i guess i'm just lucky to get a good working unit!
0,hope the unit lasts as i've only had it for 3 days.
1,and the slim form-factor together with the mirror-like front panel sure makes the player look cool and pricey!
0,one bad thing   i find the remote-control a bit flimsy and i predict it will most probably ' die ' before the player does.
1,  amazon's free shipping is really getting   it took only 3 working days for the player to reach me!
0,poor quality dvd player.
0,i purchased two of these players for christmas   and both were bad.
0,the first one wouldn't work from the start.
0,the second lasted about two weeks before the video went out!
1,amazon.com promptly refunded my money for the first   because a replacement was not available (thanks amazon.com!
0,i am still trying to resolve the problem with the second one.
0,i have tried several times to contact apex digital through their on-line support site and their telephone   but they won't answer my emails and their telephone line is always busy.
0,i will never buy another apex digital product!
0,you get what you paid for.
1,for the most part this is a good dvd player.
0,but about 25% of dvd's i've played on ithave a   when watching a movie the picture will   but the dvd still   and eventualy the picture kicks back in after skipping a few moments.
0,usually i just skip to the next chapter to avoid it.
0,annoying.
0,no picture and / or no   try i/p button on the remote.
0,we have had this product for over a month and yesterday it stopped working.
1,it is connected to an old television set via composite video and analog audio outputs.
0,there was neither picture nor sound.
0,connecting the same outputs to a video card in my   there was sound but still no picture.
0,the trouble shooting section in the user's   suggesting correct and secure   doesn't help.
1,i searched on the internet and found one tip which solved our problem: press i/p button on the remote control.
0,it makes the dvd player to switch between interlace mode and progressive scan mode.
0,obviously there is no composite video output and different analog audio signals at progressive scan mode.
1,we are overall pleased with product.
1,i would have rated it five stars but for the poor manual.
0,people with video issue's.
0,i think most of you people complaining about no video is due to you hitting the wrong button either the p/n = pal / ntsc or the i/p is set to progressive scan.
0,another stupid move.
0,buyer beware.
